{
  "kind": "cineweave_codex_character_preference_feedback",
  "contractVersion": "2.0.0",
  "worldId": "world.song-poetic-demo",
  "feedbackId": "feedback.song-woman.facial-structure-v1",
  "status": "recorded",
  "optionSetRef": {
    "id": "options.song-woman.facial-structure-v1",
    "version": 1,
    "contentHash": "sha256:3333333333333333333333333333333333333333333333333333333333333333"
  },
  "feedbackMode": "mixed",
  "signals": [
    {
      "signalId": "signal.select-02",
      "type": "select",
      "optionId": "option.facial-02",
      "targetScope": "face",
      "direction": "preserve",
      "strength": 0.9,
      "rationale": "更喜欢方案二的轮廓张力，但不要显得冷硬。"
    },
    {
      "signalId": "signal.less-04",
      "type": "more_less",
      "optionId": "option.facial-04",
      "targetScope": "jaw",
      "direction": "less",
      "strength": 0.75,
      "rationale": "不希望下颌显得太窄或太有削骨感。"
    },
    {
      "signalId": "signal.compare-02-01",
      "type": "compare",
      "optionId": "option.facial-02",
      "comparisonOptionId": "option.facial-01",
      "targetScope": "face",
      "direction": "more",
      "strength": 0.65,
      "rationale": "相较方案一，需要略多一点骨相识别度。"
    }
  ],
  "convergence": {
    "nextAction": "draft_character_spec",
    "selectedOptionIds": [
      "option.facial-02"
    ],
    "preserve": [
      "略高但不外扩的颧骨",
      "自然、非尖锐的下颌线",
      "中性真实肤质和轻微不对称"
    ],
    "requestedChanges": [
      "在下一轮中性证据中检查眼裂长度是否与轮廓协调",
      "保留温婉感，避免以强妆或硬光伪造骨相"
    ],
    "identityLockRequested": false
  },
  "policy": {
    "persistenceScope": "session",
    "userCanEditOrDelete": true,
    "universalBeautyScoreProhibited": true,
    "sensitiveInferenceProhibited": true,
    "realPersonLikenessNotInferred": true
  },
  "executionBoundary": {
    "providerNeutral": true,
    "generatesMedia": false,
    "humanApprovalRequired": true,
    "notes": "反馈只记录用户在当前候选集中的创作偏好；不会创建生物识别档案或自动锁定角色。"
  },
  "validation": {
    "optionSetBound": true,
    "userControlled": true,
    "noUniversalBeautyScore": true,
    "noBiometricInference": true,
    "noGenerationClaim": true,
    "identityNotAutoLocked": true
  },
  "skillReceipt": {
    "repository": "https://github.com/Wilder1222/cineweave-studio",
    "ref": "v2.0.0",
    "commit": "0123456789abcdef0123456789abcdef01234567",
    "contentHash": "sha256:aaaaaaaaaaaaaaaaaaaaaaaaaaaaaaaaaaaaaaaaaaaaaaaaaaaaaaaaaaaaaaaa",
    "installedBy": "codex-environment",
    "usedAt": "2026-08-20T18:00:00.000Z"
  }
}
